{
  "textVersion": "workbench-text.v1",
  "packId": "workbench-en",
  "locale": "en",
  "title": "Workbench presentation text",
  "note": "Every string a person reads that is not domain data, lifted verbatim from the frozen control-behavior record and the runtime that reproduced it. Values come from the scene contract, the camera and the run; only their phrasing comes from here. Swapping this pack changes wording, punctuation or language without touching a component identity, a binding or a scene.",
  "glyphs": {
    "separator": "·",
    "routeArrow": "→",
    "speedSuffix": "×",
    "ellipsis": "…",
    "rangeDash": "–",
    "zoomOut": "−",
    "zoomIn": "+",
    "quoteOpen": "“",
    "quoteClose": "”"
  },
  "formats": {
    "coverage": "{nodes} components {separator} {routes} routes {separator} {omitted} source components omitted",
    "zoom": "{percent}%",
    "viewOption": "{label} {separator} {nodes} components / {routes} routes",
    "speedOption": "{value}{speedSuffix}",
    "sourcePointer": "{label} {separator} SHA-256 {sha256} {separator} {pointer}",
    "routeChoice": "{label} {routeArrow} {target}",
    "traceStep": "Tracing {index} / {total} {separator} {kind}",
    "traceParallel": "Tracing {from}{rangeDash}{to} / {total} {separator} {branches} parallel branches",
    "tracePaused": "Trace paused {separator} {visited} / {total} routes",
    "traceComplete": "Trace complete {separator} {visited} / {total} routes {separator} {components} / {totalComponents} components. All declared alternatives inspected.",
    "finding": "{code}: {identity}",
    "exportFileName": "{capabilityId}-{viewId}.svg",
    "isolatedComponent": "isolated component",
    "phaseStatus": "{phase} {separator} {status} {separator} {observedAt}",
    "metricTimestamp": "Market time {separator} {timestamp}",
    "runCapabilityHint": "Choose a {quoteOpen}Run capability{quoteClose} source view, then select its input component."
  },
  "messages": {
    "traceIdle": "Select a component, then follow its declared routes.",
    "traceIdleExpression": "Arrows show named expression dependencies; conditional arguments remain distinct.",
    "convergence": "Convergence: inspect its declared requirements before following the continuation.",
    "fanOut": "All fan-out members are declared. Choose a member to inspect.",
    "chooseRoute": "Choose a declared route to follow. Alternatives are not executed by this diagram.",
    "endOfPath": "End of this declared path.",
    "loadingGraph": "Loading source graph{ellipsis}",
    "graphUnavailable": "Source graph unavailable",
    "graphIdentityMismatch": "Source graph identity mismatch",
    "sceneContractUnsupported": "Source graph contract unsupported",
    "sceneUnpublished": "No scene is published for this view.",
    "sceneLoadFailed": "The source graph for this view could not be loaded.",
    "anchorUnavailable": "This capability's node is not in the current view.",
    "inspectPrompt": "Select a component or route to inspect its meaning.",
    "outlineEmpty": "No component matches this search.",
    "submitting": "Submitting{ellipsis}",
    "runAccepted": "Accepted {separator} waiting for reported execution",
    "connectionInterrupted": "Connection interrupted {separator} the run may still be executing. Reconnecting to its retained status{ellipsis}",
    "outcomeReceived": "Outcome received {separator} select the outcome node to reopen it.",
    "runEnded": "Run ended {separator} inspect the reported status.",
    "valueNull": "None",
    "valueNotReported": "Not reported",
    "resultHeading": "Result"
  },
  "playLabels": {
    "idle": "Trace flow",
    "running": "Pause trace",
    "paused": "Resume trace",
    "complete": "Replay trace"
  },
  "viewKindNames": {
    "blueprint": "Blueprint authority",
    "operations": "Declared operation flow",
    "native": "Native execution graph",
    "expression": "Mechanic dependencies",
    "invocation": "Executable scenario interface"
  },
  "unresolvedTemplate": "«{name} unresolved»"
}
